,2022,Julio-Septiembre,Fraccionamiento habitacional,Praderas De San Francisco,Calle,San juan I cruz con san Gelasio 1,no,si,no,no,no,no,0,"25.817598, -100.409332",
,2022,Julio-Septiembre,Fraccionamiento habitacional,Praderas De San Francisco,Calle,Juan pablo II cruz con San Marcelo,no,si,no,si,no,no,0,"25.822081, -100.404043",
,2022,Julio-Septiembre,Fraccionamiento habitacional,Praderas De San Francisco,Calle,San Silvestre 1,si,si,no,si,no,no,0,"25.822521, -100.406343",
,2022,Julio-Septiembre,Fraccionamiento habitacional,Praderas De San Francisco,Calle,San Teodoro Y San Francisco De Lego,no,si,si,si,no,no,0,"25.817366, -100.413118",
,2022,Julio-Septiembre,Fraccionamiento habitacional,Praderas De San Francisco,Calle,Juan Pablo 2 cruz con San Cesidio,no,no,no,no,no,no,0,"25.818774, -100.412725",
,2022,Julio-Septiembre,Fraccionamiento habitacional,Praderas De San Francisco,Calle,San Felipe De Jesus,no,no,no,no,no,no,0,"25.820752, -100.417022",
,2022,Julio-Septiembre,Fraccionamiento habitacional,Praderas De San Francisco,Calle,San Bartolome,no,no,no,no,no,no,0,"25.820671, -100.417214",
,2022,Julio-Septiembre,Fraccionamiento habitacional,Privada San José,Avenida,Manzano,si,si,si,si,no,si,2,"25.813308, -100.305356",
,2022,Julio-Septiembre,Fraccionamiento habitacional,Privadas De Camino Real 1,Calle,"Priv. Camino Real, calle Priv. Real cruz con Camino Privado",si,si,si,si,no,si,1,"25.807205, -100.389849",
,2022,Julio-Septiembre,Fraccionamiento habitacional,Privadas De Camino Real 2,Avenida,Calle Faisán y Paseo de las Aves,si,si,no,no,no,no,0,"25.841117, -100.401411",
,2022,Julio-Septiembre,Fraccionamiento habitacional,Privadas De Camino Real 2,Calle,Calle Condor,si,si,no,no,no,no,0,"25.841664, -100.399914",
,2022,Julio-Septiembre,Fraccionamiento habitacional,Privadas Del Sauce IV,Calle,Calle Azaleas cruz con Alcatraz,si,si,si,si,no,si,1,"25.820674, -100.310558",
,2022,Julio-Septiembre,Fraccionamiento habitacional,Providencia,Calle,Jesus Ayala Lopez Y Tulipan,no,si,no,si,no,si,1,"25.809793, -100.335684",
,2022,Julio-Septiembre,Fraccionamiento habitacional,Provileon,Calle,Calle Cerro del Tepeyac cruz con Obispado,no,si,si,si,no,no,0,"25.787078, -100.337086",
,2022,Julio-Septiembre,Fraccionamiento habitacional,Quintas De Anáhuac,Avenida,Ave. República Mexicana cruz con los Álamos,si,si,no,si,no,si,2,"25.779196, -100.273822",
,2022,Julio-Septiembre,Fraccionamiento habitacional,Quinto Centenario,Avenida,Calle Cristóbal Colon cruz con Reyna Isabel de Castilla,no,si,si,si,no,no,0,"25.788965, -100.332422",
,2022,Julio-Septiembre,Fraccionamiento habitacional,Renacimiento 1,Calle,Galileo Galilei y ave. Las torres,no,si,si,si,no,no,0,"25.800062, -100.331346",
,2022,Julio-Septiembre,Fraccionamiento habitacional,Renacimiento 2,Calle,Leonardo da Vinci,no,si,no,si,no,no,2,"25.805944, -100.332977",
,2022,Julio-Septiembre,Fraccionamiento habitacional,Residencial California,Calle,Calle Santa Mónica Cruz con Santa cruz,si,si,si,si,no,si,2,"25.770926, -100.313824",
,2022,Julio-Septiembre,Fraccionamiento habitacional,Residencial Escobedo,Calle,Calle los Álamos cruz con Abedules,si,si,si,no,no,no,0,"25.784777, -100.309987",
,2022,Julio-Septiembre,Fraccionamiento habitacional,Residencial Palmiras,Calle,Calle Siete,si,si,no,no,no,no,0,"25.841541, -100.425501",
,2022,Julio-Septiembre,Fraccionamiento habitacional,Residencial Palmiras,Calle,Calle Pino Poniente,no,si,no,no,no,no,0,"25.843356, -100.422561",
,2022,Julio-Septiembre,Fraccionamiento habitacional,Residencial San Miguel,Calle,Calle San Fernando entre San Benito y San Jorge,si,si,si,si,no,no,0,"25.838939, -100.371069",
,2022,Julio-Septiembre,Fraccionamiento habitacional,Residencial San Miguel,Avenida,Camellón de ave. Carpintero y San Fernando,no,no,no,no,no,no,0,"25.832961, -100.372557",
,2022,Julio-Septiembre,Fraccionamiento habitacional,Rincón De La Encinas,Avenida,Av. Jardines Del Canada Y Rincon Del Arroyo,si,si,si,si,no,si,1,"25.802787, -100.308219",
,2022,Julio-Septiembre,Fraccionamiento habitacional,Rincon de Miravista,Calle,Calle Ocampo Placita 1,si,si,si,no,no,si,1,"25.803825, -100.313277",
,2022,Julio-Septiembre,Fraccionamiento habitacional,San Marcos,Calle,Gilberto Armienta calderón y circuito Abelardo Leal,si,si,no,no,no,no,0,"25.799692, -100.407308",
,2022,Julio-Septiembre,Fraccionamiento habitacional,San Marcos,Calle,Vianey y Raúl Velazco,si,si,si,si,no,si,1,"25.798469, -100.404383",
,2022,Julio-Septiembre,Fraccionamiento habitacional,San Marcos,Calle,Circuito Jorge Villegas y el tío Rodolfo Guzmán,si,si,no,si,no,no,0,"25.801867, -100.41007",
,2022,Julio-Septiembre,Fraccionamiento habitacional,San Marcos 2,Calle,Calle Héctor Benavides y Nena Delgado,si,si,no,si,no,no,0,"25.802108, -100.408412",
,2022,Julio-Septiembre,Fraccionamiento habitacional,Serranías,Calle,Plaza Mirador calle Nacatas,si,no,no,no,no,no,0,"25.802105, -100.366184",
,2022,Julio-Septiembre,Fraccionamiento habitacional,Topo Grande,Calle,Calle Covadonga Y Pontevedra,si,si,no,si,no,no,0,"25.790476, -100.317037",
,2022,Julio-Septiembre,Fraccionamiento habitacional,Valles De San Francisco,Avenida,Av. Las águilas y Bolonia,si,si,si,no,no,si,1,"25.806874, -100.392886",
,2022,Julio-Septiembre,Fraccionamiento habitacional,Valles De San Francisco,Calle,Corcega Y Palermo,si,si,si,si,no,si,3,"25.805654, -100.396521",
,2022,Julio-Septiembre,Fraccionamiento habitacional,Villas De Anáhuac Sector Alpes,Avenida,"Avenida Camino Real, plaza común",si,si,si,si,no,no,0,"25.770647, -100.284711",
,2022,Julio-Septiembre,Fraccionamiento habitacional,Villas De San Francisco,Avenida,Calle Águila Real entre Correcaminos y Cuitlacoche,si,si,si,si,no,no,0,"25.838112, -100.365434",
,2022,Julio-Septiembre,Fraccionamiento habitacional,Villas De San Francisco,Calle,San Francisco de Asís entre Gaviota y Gallineta,si,si,si,si,no,si,1,"25.840711, -100.367708",
,2022,Julio-Septiembre,Fraccionamiento habitacional,Villas De San Francisco,Calle,Calle San Francisco de Asís entre Colibrí y Clarín,si,si,si,si,no,si,2,"25.835584, -100.367281",
,2022,Octubre-Diciembre,Fraccionamiento habitacional,18 De Octubre,Avenida,calle 24 de Septiembre cruz con 24 de Junio,si,si,si,si,no,si,1,"25.797228, -100.399578",
,2022,Octubre-Diciembre,Fraccionamiento habitacional,Alianza Real,Avenida,Avenida Juárez y Art.5,si,si,si,si,no,no,0,"25.844528, -100.384861",
,2022,Octubre-Diciembre,Fraccionamiento habitacional,Alianza Real,Calle,Barrio Veracruz calle Priv. Catemaco,si,si,no,si,no,no,0,"25.847361, -100.398333",
,2022,Octubre-Diciembre,Fraccionamiento habitacional,Alianza Real,Calle,Alianza real lado poniente,si,si,no,si,no,si,2,"25.844303, -100.385745",
,2022,Octubre-Diciembre,Fraccionamiento habitacional,Alianza Real,Calle,Privada San Blas Y Av. Revolucion,no,no,no,no,no,no,0,"25.84873, -100.382437",
,2022,Octubre-Diciembre,Fraccionamiento habitacional,Alianza Real,Calle,Barrio Michoacán,no,no,no,no,no,no,0,"25.846866, -100.38202",
,2022,Octubre-Diciembre,Fraccionamiento habitacional,Alianza Real,Calle,Barrio Morelos Privada Ecatepec Y Atizapan,no,no,no,no,no,no,0,"25.845804, -100.384972",
,2022,Octubre-Diciembre,Fraccionamiento habitacional,Alianza Real,Calle,Barrio Guanajuato Privada Salamanca,no,no,no,no,no,no,0,"25.845043, -100.389455",
,2022,Octubre-Diciembre,Fraccionamiento habitacional,Alianza Real,Calle,Barrio Guanajuato Privada Dolores Hidalgo,no,no,no,no,no,no,0,"25.844278, -100.389082",
,2022,Octubre-Diciembre,Fraccionamiento habitacional,Alianza Real,Calle,Barrio Puebla Privada Jalpan,no,no,no,no,no,no,0,"25.848632, -100.391036",
,2022,Octubre-Diciembre,Fraccionamiento habitacional,Alianza Real,Calle,Barrio Campeche Privada Carmen,no,no,no,no,no,no,0,"25.844553, -100.390616",
,2022,Octubre-Diciembre,Fraccionamiento habitacional,Alianza Real,Calle,Barrio Campeche Privada Candelaria,no,no,no,no,no,no,0,"25.843784, -100.390253",
,2022,Octubre-Diciembre,Fraccionamiento habitacional,Alianza Real,Calle,Barrio Chihuahua Privada Heroes De La Revolución,no,no,no,no,no,no,0,"25.842707, -100.393264",
,2022,Octubre-Diciembre,Fraccionamiento habitacional,Alianza Real,Calle,Barrio Nuevo León Privada Guadalupe Y Av. Revolucion,no,no,no,no,no,no,0,"25.845783, -100.39073",
,2022,Octubre-Diciembre,Fraccionamiento habitacional,Alianza Real,Calle,Barrio Nuevo León Privada Santiago,no,no,no,no,no,no,0,"25.84528, -100.394347",
,2022,Octubre-Diciembre,Fraccionamiento habitacional,Alianza Real,Calle,Barrio Nuevo León Privada Santa Catarina,no,no,no,no,no,no,0,"25.846403, -100.391412",
,2022,Octubre-Diciembre,Fraccionamiento habitacional,Alianza Real,Avenida,Barrio Jalisco San Salvador Y Av. Revolucion,no,no,no,no,no,no,0,"25.845924, -100.390274",
,2022,Octubre-Diciembre,Fraccionamiento habitacional,Alianza Real,Calle,Barrio Durango Privada Gomez Palacio,no,no,no,no,no,no,0,"25.843893, -100.394643",
,2022,Octubre-Diciembre,Fraccionamiento habitacional,Alianza Real,Calle,Barrio Durango Privada San Pedro Del Gallo,no,no,no,no,no,no,0,"25.843041, -100.394702",
,2022,Octubre-Diciembre,Fraccionamiento habitacional,Alianza Real,Calle,Barrio Durango Privada Ricon De Romos,no,no,no,no,no,no,0,"25.842322, -100.394463",
,2022,Octubre-Diciembre,Fraccionamiento habitacional,Alianza Real,Calle,Barrio Coahuila Privada Saltillo,no,no,no,no,no,no,0,"25.844533, -100.398651",
,2022,Octubre-Diciembre,Fraccionamiento habitacional,Alianza Real,Calle,Barrio Coahuila Privada 5 De Mayo,no,no,no,no,no,no,0,"25.845532, -100.395843",
,2022,Octubre-Diciembre,Fraccionamiento habitacional,Alianza Real,Avenida,Barrio Coahuila Privada Acuña Y Av. Revolucion,no,no,no,no,no,no,0,"25.84312, -100.398038",
,2022,Octubre-Diciembre,Fraccionamiento habitacional,Alianza Real,Calle,Barrio Mexico Valle De Bravo Y Art. 5,no,no,no,no,no,no,0,"25.84707, -100.385939",
,2022,Octubre-Diciembre,Fraccionamiento habitacional,Alianza Real,Calle,Barrio Puebla  Privada Tlaxco,no,no,no,no,no,no,0,"25.850046, -100.386904",
,2022,Octubre-Diciembre,Fraccionamiento habitacional,Alianza Real,Calle,Barrio Baja California Privada Mexicali,no,no,no,no,no,no,0,"25.850538, -100.392277",
,2022,Octubre-Diciembre,Fraccionamiento habitacional,Alianza Real,CALLE,AVE. CONSTITUCION POR AV. CAMINO A LAS PEDRERAS,no,no,no,no,no,no,0,"25.838446, -100.410442",
,2022,Octubre-Diciembre,Fraccionamiento habitacional,Balcones De Anáhuac,Avenida,Ave. Sendero y San Felipe,si,si,si,si,no,si,3,"25.764111, -100.327111",
,2022,Octubre-Diciembre,Fraccionamiento habitacional,Balcones De Anáhuac,Calle,Calle San Judas Tadeo y San Ignacio,no,no,no,no,no,no,0,"25.765233, -100.325909",
,2022,Octubre-Diciembre,Fraccionamiento habitacional,Balcones Del Norte,Calle,Calle Dignidad cruz con Poder y Justicia,si,si,si,si,no,si,1,"25.812861, -100.264028",
,2022,Octubre-Diciembre,Fraccionamiento habitacional,Bosques De Escobedo,Calle,Calle Isla Guadalupe cruz con Isla Virgen,no,si,si,si,no,si,1,"25.807389, -100.33625",
,2022,Octubre-Diciembre,Fraccionamiento habitacional,Bosques De Quebec,Calle,Calle Toronto cruz con Quebec,si,si,si,no,no,si,1,"25.800918, -100.320312",
,2022,Octubre-Diciembre,Fraccionamiento habitacional,Colinas De Anáhuac 2,Calle,Calle Monte Olivo Y Monte Moria,si,si,no,si,no,no,0,"25.770094, -100.323326",
,2022,Octubre-Diciembre,Fraccionamiento habitacional,Colinas De Anáhuac I,Calle,Ave. Acueducto y calle sierra madre,si,si,si,no,no,no,0,"25.770157, -100.325988",
,2022,Octubre-Diciembre,Fraccionamiento habitacional,Colinas Del Topo,Calle,Calle Escobedo e Higueras,si,si,si,si,no,no,0,"25.799081, -100.372376",
,2022,Octubre-Diciembre,Fraccionamiento habitacional,Escobedo Centro,Avenida,Jiménez y Juárez,no,no,si,no,no,si,1,"25.807707, -100.320118",
,2022,Octubre-Diciembre,Fraccionamiento habitacional,Felipe Carrillo,Avenida,Ave. José Ma. Morelos cruz con Crescencio Monroy,si,si,si,si,no,no,0,"25.778808, -100.322738",
,2022,Octubre-Diciembre,Fraccionamiento habitacional,Felipe Carrillo,Calle,Calle Pablo A. De la Garza cruz con Eduardo A. Elizondo,si,si,no,si,no,si,1,"25.778712, -100.32223",
,2022,Octubre-Diciembre,Fraccionamiento habitacional,Fomerrey 9,Avenida,"Col. Fomerrey 9, calle Plinio de Ordoñez cruz con Vía Torreón",no,si,si,no,no,no,0,"25.791101, -100.328352",
,2022,Octubre-Diciembre,Fraccionamiento habitacional,Fraccionamiento Vida,Avenida,"Col. Vida, Ave. Monterrey cruz con Priv. Vientos Alisios",si,si,si,no,no,si,2,"25.800743, -100.391697",
,2022,Octubre-Diciembre,Fraccionamiento habitacional,Fuentes De Escobedo,Calle,"Calle Fuente Del Salto , Fuente de Trevi y fuente del sol",si,si,si,si,no,no,0,"25.786871, -100.312083",
,2022,Octubre-Diciembre,Fraccionamiento habitacional,Hacienda El Vergel,Calle,"Col. Hacienda el Vergel, Viura y Cavernet (ZARAGOZA)",no,si,si,no,no,no,0,"25.81141, -100.340816",
,2022,Octubre-Diciembre,Fraccionamiento habitacional,Haciendas De Escobedo,Avenida,Ave. Hacienda del Rey cruz con Hacienda San Carlos,si,si,si,si,no,no,0,"25.78435, -100.30534",
,2022,Octubre-Diciembre,Fraccionamiento habitacional,Haciendas De Escobedo,Avenida,Ave. Haciendas del Rey cruz con Hacienda de Nísperos,si,si,si,si,no,si,1,"25.788961, -100.305561",
,2022,Octubre-Diciembre,Fraccionamiento habitacional,Haciendas Del Topo,Calle,Calle Hacienda del Recodo cruz con Hacienda de Santa Julia,no,si,si,no,no,si,3,"25.788136, -100.331383",
,2022,Octubre-Diciembre,Fraccionamiento habitacional,Insurgentes,Calle,Calle Insurgentes cruz con Celestino Gasca,si,si,si,no,no,no,0,"25.776526, -100.319672",
,2022,Octubre-Diciembre,Fraccionamiento habitacional,Jardines De Escobedo 2,Avenida,Héctor Ayala y vía a Torreón,no,si,no,no,no,no,0,"25.800347, -100.330129",
,2022,Octubre-Diciembre,Fraccionamiento habitacional,Jardines Del Canadá,Calle,Rio suchiate y Rio Maple,no,si,no,no,no,no,0,"25.79751, -100.306327",
,2022,Octubre-Diciembre,Fraccionamiento habitacional,La Concordia,Calle,Col. Concordia Calle Colombia Y Anahuac,si,si,si,no,no,no,0,"25.802788, -100.389624",
,2022,Octubre-Diciembre,Fraccionamiento habitacional,La Concordia,Calle,"Col. Concordia Calle Higueras, Melchor Ocampo Y Mina",si,si,si,si,no,no,0,"25.802732, -100.391453",
,2022,Octubre-Diciembre,Fraccionamiento habitacional,La Concordia 1,Calle,"Col. La Concordia 1er sector, Priv. Dr. Mier cruz con Mina",si,si,si,no,no,si,1,"25.803574, -100.390602",
,2022,Octubre-Diciembre,Fraccionamiento habitacional,La Concordia 2,Calle,Calle Prolongación Anáhuac cruz con General Bravo,si,no,no,si,no,no,0,"25.803117, -100.389892",
,2022,Octubre-Diciembre,Fraccionamiento habitacional,La Concordia 3,Calle,"Col. La Concordia 3er sector, calle Vallecillos cruz con Prolongación Anáhuac",si,si,si,no,no,si,1,"25.802261, -100.389316",
,2022,Octubre-Diciembre,Fraccionamiento habitacional,La Concordia 6,Calle,"Col. La Concordia 6to sector, calle Los Aldama cruz con Priv. Los Aldama",si,si,si,no,no,no,0,"25.801535, -100.390936",
,2022,Octubre-Diciembre,Fraccionamiento habitacional,La Unidad,Calle,Calle Unidad Agraria Y Unidad Laboral,si,si,si,si,no,si,2,"25.791701, -100.417179",
,2022,Octubre-Diciembre,Fraccionamiento habitacional,La Unidad,Calle,Calle Unidad Mundial Y Unidad Organica,si,si,si,si,no,no,0,"25.793564, -100.412073",
,2022,Octubre-Diciembre,Fraccionamiento habitacional,La Unidad,Calle,U. Técnica. Comercial y u. Revolucionaria,si,si,si,si,no,si,1,"25.796911, -100.418715",
,2022,Octubre-Diciembre,Fraccionamiento habitacional,Laderas De San Miguel,Avenida,"Av. Laderas de san miguel, Orquideas Y Catarino",si,si,no,si,no,si,1,"25.841548, -100.408237",
,2022,Octubre-Diciembre,Fraccionamiento habitacional,Laderas De San Miguel 1,Avenida,Av. Laderas Y Sicomoro,si,no,no,si,no,no,0,"25.844669, -100.409087",
,2022,Octubre-Diciembre,Fraccionamiento habitacional,Laderas De San Miguel 1,Avenida,Av. Laderas Y Adianto,si,si,no,si,no,no,0,"25.844732, -100.408408",
,2022,Octubre-Diciembre,Fraccionamiento habitacional,Laderas De San Miguel 1,Calle,Calle Ninfa Y Castañeda,si,si,no,no,no,no,0,"25.842804, -100.407769",
,2022,Octubre-Diciembre,Fraccionamiento habitacional,Laderas De San Miguel 1,Calle,Calle Cardo Y Junipero,no,no,no,no,no,no,0,"25.841791, -100.407467",
,2022,Octubre-Diciembre,Fraccionamiento habitacional,Laderas De San Miguel 2,Avenida,Calle av. Laderas y maple,si,si,no,si,no,no,0,"25.838478, -100.405011",
,2022,Octubre-Diciembre,Fraccionamiento habitacional,Lomas De Escobedo,Avenida,"Col. Lomas de Escobedo, Ave. Las Torres cruz con 27 de Octubre",si,si,si,si,no,si,2,"25.79056, -100.320074",
,2022,Octubre-Diciembre,Fraccionamiento habitacional,Lomas De San Genaro,Calle,"Paraíso, tulias y mango",no,si,si,si,no,no,0,"25.783416, -100.339392",
,2022,Octubre-Diciembre,Fraccionamiento habitacional,Lomas De San Genaro,Avenida,Abeto y las lomas,no,si,si,no,no,no,0,"25.778252, -100.334394",
,2022,Octubre-Diciembre,Fraccionamiento habitacional,Los Altos,Calle,Calle Lerdo de Tejada y Morelos,si,si,si,si,no,no,0,"25.795354, -100.290958",
,2022,Octubre-Diciembre,Fraccionamiento habitacional,Los Cavasitos,Avenida,2 plazas av. Carretera a Colombia,si,no,no,no,no,si,1,"25.788271, -100.29238",
,2022,Octubre-Diciembre,Fraccionamiento habitacional,Los Olivos,Calle,Calle Ramiro Tamez Y Pablo Quiroga,no,si,si,si,no,no,0,"25.801389, -100.325969",
,2022,Octubre-Diciembre,Fraccionamiento habitacional,Los Olivos 1 ° Sec,Calle,Anacleto guerrero,no,si,no,no,no,no,0,"25.800836, -100.326033",
,2022,Octubre-Diciembre,Fraccionamiento habitacional,Miravista,Avenida,Ave. Paseo de la Amistad cruz con Mariano Matamoros,si,si,si,si,no,si,1,"25.80186, -100.314328",
,2022,Octubre-Diciembre,Fraccionamiento habitacional,Miravista,Avenida,General Cepeda Y Calle Parras,si,si,si,si,no,no,0,"25.809216, -100.314484",
,2022,Octubre-Diciembre,Fraccionamiento habitacional,Monclova,Calle,Calle administradores y profesionistas,no,si,si,no,no,si,1,"25.814727, -100.398906",
,2022,Octubre-Diciembre,Fraccionamiento habitacional,Monterreal,Calle,"Col. Monterreal, calle Monte Albán cruz con Cantábricos",si,si,si,si,no,no,0,"25.795791, -100.318172",
,2022,Octubre-Diciembre,Fraccionamiento habitacional,Monterreal,Avenida,Paseo de la Amistad entre Paseo Dominical y Paseo del Huerto,si,si,no,no,no,no,0,"25.794296, -100.317326",
,2022,Octubre-Diciembre,Fraccionamiento habitacional,Monterreal,Calle,"Col. Monterreal 2do sector, calle Circuito de la Paz y 2do Andador de la Paz",si,si,si,no,no,no,0,"25.79815, -100.314777",
,2022,Octubre-Diciembre,Fraccionamiento habitacional,Nueva Esperanza,Calle,"Col. Nueva Esperanza, calle Iturbide cruz con Andrés Montoya",si,si,si,si,no,si,8,"25.797324, -100.389373",
,2022,Octubre-Diciembre,Fraccionamiento habitacional,Nueva Esperanza,Calle,"Col. Nueva Esperanza 2do sector, calle Linares cruz con Salinas Victoria",si,si,si,si,no,si,1,"25.797271, -100.392518",
,2022,Octubre-Diciembre,Fraccionamiento habitacional,Paseo Real,Calle,José gpe. Posada y José Luis cuevas,no,no,si,si,no,no,0,"25.798104, -100.334331",
,2022,Octubre-Diciembre,Fraccionamiento habitacional,Pedregal,Calle,Cromo y titanio,si,si,si,no,no,si,1,"25.806869, -100.367048",
,2022,Octubre-Diciembre,Fraccionamiento habitacional,Portal Del Fraile,Calle,Fray Manuel y unidad orgánica,si,si,no,si,no,si,1,"25.797339, -100.412804",
,2022,Octubre-Diciembre,Fraccionamiento habitacional,Praderas De San Francisco,Calle,San Orlando cruz con San Fabián,no,si,no,no,no,no,0,"25.816265, -100.40709",
,2022,Octubre-Diciembre,Fraccionamiento habitacional,Praderas De San Francisco,Calle,Honorio 1 cruz con Juan cuarto,no,si,no,no,no,no,0,"25.823901, -100.411366",
,2022,Octubre-Diciembre,Fraccionamiento habitacional,Praderas De San Francisco,Calle,Juan Pablo 2 cruz con San Benito de Aniane,no,si,si,no,no,no,0,"25.817663, -100.415244",
,2022,Octubre-Diciembre,Fraccionamiento habitacional,Praderas De San Francisco,Calle,Santa Catarina,no,si,no,no,no,no,0,"25.817309, -100.412384",
,2022,Octubre-Diciembre,Fraccionamiento habitacional,Praderas De San Francisco,Calle,San Francisco de Asís,no,si,no,si,no,no,0,"25.815585, -100.4173",
,2022,Octubre-Diciembre,Fraccionamiento habitacional,Praderas De San Francisco,Calle,Juan Pablo II Y San Pedro,si,si,si,si,no,si,5,"25.819831, -100.405362",
,2022,Octubre-Diciembre,Fraccionamiento habitacional,Praderas De San Francisco,Calle,San Benito De Aniane Y San Diego De Alcala,no,si,si,si,no,si,5,"25.82236, -100.417943",
,2022,Octubre-Diciembre,Fraccionamiento habitacional,Praderas De San Francisco,Calle,San Felipe De Jesus,no,no,no,no,no,no,0,"25.820752, -100.417022",
,2022,Octubre-Diciembre,Fraccionamiento habitacional,Privadas De Camino Real 1,Calle,"Priv. Camino Real, calle Priv. Real cruz con Camino Privado",si,si,si,si,no,si,1,"25.807205, -100.389849",
,2022,Octubre-Diciembre,Fraccionamiento habitacional,Privadas De Camino Real 2,Avenida,Calle Faisán y Paseo de las Aves,si,si,no,no,no,no,0,"25.841117, -100.401411",
,2022,Octubre-Diciembre,Fraccionamiento habitacional,Providencia,Avenida,Jesus Ayala Lopez Y Noche Buena,si,no,no,no,no,no,0,"25.810195, -100.335587",
,2022,Octubre-Diciembre,Fraccionamiento habitacional,Provileon,Calle,Calle Cerro del Venado cruz con Cerro de la Silla,no,si,si,si,no,no,0,"25.784067, -100.334987",
,2022,Octubre-Diciembre,Fraccionamiento habitacional,Provileon,Calle,Cerro del Tepeyac con Cerro del Vigía,no,no,no,no,no,no,0,"25.787967, -100.33717",
,2022,Octubre-Diciembre,Fraccionamiento habitacional,Residencial Escobedo,Calle,Calle los Álamos cruz con Eucaliptos,si,si,si,si,no,no,0,"25.788259, -100.309379",
,2022,Octubre-Diciembre,Fraccionamiento habitacional,Residencial Las Flores,Calle,Calle Margarita cruz con Alhelí,si,si,si,si,no,si,4,"25.803783, -100.395708",
,2022,Octubre-Diciembre,Fraccionamiento habitacional,Residencial Palmiras,Calle,Calle primera,no,si,no,no,no,no,0,"25.843447, -100.426728",
,2022,Octubre-Diciembre,Fraccionamiento habitacional,Residencial San Miguel,Calle,Calle San Fernando entre San Benito y San Jorge,si,si,si,si,no,no,0,"25.838939, -100.371069",
,2022,Octubre-Diciembre,Fraccionamiento habitacional,Residencial San Miguel,Avenida,San Fernando   entre san Jorge y Grulla,si,si,si,si,no,si,2,"25.841477, -100.370839",
,2022,Octubre-Diciembre,Fraccionamiento habitacional,Residencial San Miguel,Avenida,Camellón de ave. Carpintero y San Fernando,no,no,no,no,no,no,0,"25.832961, -100.372557",
,2022,Octubre-Diciembre,Fraccionamiento habitacional,Riberas De Girasoles,Calle,Calle Sierra Madre cruz con Cerro del Topo Chico,si,si,si,no,no,no,0,"25.786336, -100.31748",
,2022,Octubre-Diciembre,Fraccionamiento habitacional,Rincón De La Encinas,Avenida,Av. Jardines Del Canada Y Rincon Del Arroyo,si,si,si,si,no,si,1,"25.802787, -100.308219",
,2022,Octubre-Diciembre,Fraccionamiento habitacional,Roble Nuevo,Calle,Calle Villas de Colombia cruz con Villas de Paraguay,si,si,si,si,no,si,1,"25.784127, -100.314848",
,2022,Octubre-Diciembre,Fraccionamiento habitacional,San Genaro,Avenida,San Idelfonso Y Plinio Ordoñez,no,si,si,si,no,no,0,"25.781977, -100.330906",
,2022,Octubre-Diciembre,Fraccionamiento habitacional,San Marcos,Calle,Vianey y Raúl Velazco,si,si,si,si,no,si,1,"25.798469, -100.404383",
,2022,Octubre-Diciembre,Fraccionamiento habitacional,San Marcos,Calle,Calle J. Marroquín Leal y Carlos Torres,si,si,si,si,no,si,1,"25.794752, -100.410877",
,2022,Octubre-Diciembre,Fraccionamiento habitacional,San Marcos,Calle,Cto. Horacio alvarado Y Fray Manuel,si,si,no,no,no,no,0,"25.79954, -100.409253",
,2022,Octubre-Diciembre,Fraccionamiento habitacional,Santa Luz,Avenida,Calle Roma y Av. Unión incluye Circuito Roma,si,si,si,si,si,no,0,"25.797497, -100.34564",
,2022,Octubre-Diciembre,Fraccionamiento habitacional,Valles De San Francisco,Avenida,Calle Pisa cruz con Ave. Monterrey,si,si,si,si,no,si,1,"25.806084, -100.393156",
,2022,Octubre-Diciembre,Fraccionamiento habitacional,Valles De San Francisco,Avenida,Av. Las águilas y Bolonia,si,si,si,no,no,si,1,"25.806874, -100.392886",
,2022,Octubre-Diciembre,Fraccionamiento habitacional,Villa Alta,Calle,Calle Monterrey cruz con Priv. Allende,no,si,si,si,no,si,1,"25.80507, -100.321678",
,2022,Octubre-Diciembre,Fraccionamiento habitacional,Villas De San Francisco,Avenida,Calle Águila Real entre Correcaminos y Cuitlacoche,si,si,si,si,no,no,0,"25.838112, -100.365434",
,2022,Octubre-Diciembre,Fraccionamiento habitacional,Villas De San Francisco,Calle,Calle San Francisco de Asís y Tordo,si,si,no,si,no,si,1,"25.846258, -100.367995",
,2021,Octubre-Diciembre,Fraccionamiento habitacional,18 De Octubre,Calle,calle 13 de Septiembre cruz con 13 de Mayo,si,si,no,si,no,no,0,"25.795333, -100.397472",
,2021,Octubre-Diciembre,Fraccionamiento habitacional,Alianza Real,Calle,Barrio Michoacán calle la Piedad,si,si,no,si,no,si,1,"25.847528, -100.382308",
,2021,Octubre-Diciembre,Fraccionamiento habitacional,Alianza Real,Calle,Privada San Blas Y Av. Revolucion,no,no,no,no,no,no,0,"25.84873, -100.382437",
,2021,Octubre-Diciembre,Fraccionamiento habitacional,Alianza Real,Calle,Barrio Michoacán,no,no,no,no,no,no,0,"25.846866, -100.38202",
,2021,Octubre-Diciembre,Fraccionamiento habitacional,Alianza Real,Avenida,Barrio Guerrero Privada Cautepec,no,no,no,no,no,no,0,"25.846024, -100.386434",
,2021,Octubre-Diciembre,Fraccionamiento habitacional,Alianza Real,Calle,Barrio Jalisco Privada Puerto Vallarta,no,no,no,no,no,no,0,"25.847869, -100.387234",
,2021,Octubre-Diciembre,Fraccionamiento habitacional,Alianza Real,Calle,Barrio Hidalgo Privada San Juan De Los Lagos,no,no,no,no,no,no,0,"25.848602, -100.387539",
,2021,Octubre-Diciembre,Fraccionamiento habitacional,Alianza Real,Avenida,Barrio Campeche  Av. Revolucion Y Articulo 123,no,no,no,no,no,no,0,"25.845298, -100.390653",
,2021,Octubre-Diciembre,Fraccionamiento habitacional,Alianza Real,Calle,Barrio Nuevo León Gral Escobedo Y Av. Revolucion,no,no,no,no,no,no,0,"25.844383, -100.394393",
,2021,Octubre-Diciembre,Fraccionamiento habitacional,Alianza Real,Calle,Barrio Nuevo León Privada Santa Catarina,no,no,no,no,no,no,0,"25.846403, -100.391412",
