,2022,Octubre-Diciembre,Fraccionamiento habitacional,Alianza Real,Calle,Barrio Jalisco Privada Emiliano Zapata,no,no,no,si,no,no,0,"25.846827, -100.390134",
,2022,Octubre-Diciembre,Fraccionamiento habitacional,Alianza Real,Calle,Barrio Coahuila Privada Torreon,no,si,no,no,no,no,0,"25.843822, -100.398346",
,2022,Octubre-Diciembre,Fraccionamiento habitacional,Alianza Real,Calle,Barrio Puerta del Sol Calle Chemac,si,si,no,no,no,si,1,"25.845628, -100.404085",
,2022,Octubre-Diciembre,Fraccionamiento habitacional,Alianza Real,Calle,Barrio Puerta del Sol Calle Mayapan,si,si,no,si,no,no,0,"25.845002, -100.403629",
,2022,Octubre-Diciembre,Fraccionamiento habitacional,Alianza Real,Calle,Barrio Puerta del Sol Calle Chichimila,si,si,no,no,no,no,0,"25.844657, -100.40336",
,2022,Octubre-Diciembre,Fraccionamiento habitacional,Alianza Real,Calle,Barrio Puerta del Sol  Calle Merida,si,si,no,no,no,no,0,"25.844062, -100.402946",
,2022,Octubre-Diciembre,Fraccionamiento habitacional,Alianza Real,Calle,Privada Bellas artes,no,no,si,no,no,no,0,"25.847177, -100.380894",
,2022,Octubre-Diciembre,Fraccionamiento habitacional,Alianza Real,Calle,Barrio Nayarit /Tepic y Guayabitos,no,no,no,no,no,no,0,"25.849035, -100.383792",
,2022,Octubre-Diciembre,Fraccionamiento habitacional,Alianza Real,Avenida,Barrio Guerrero Privada Atoyac Y Av. Revolucion,no,no,no,no,no,no,0,"25.846917, -100.386385",
,2022,Octubre-Diciembre,Fraccionamiento habitacional,Alianza Real,Calle,Barrio Jalisco Privada Puerto Vallarta,no,no,no,no,no,no,0,"25.847869, -100.387234",
,2022,Octubre-Diciembre,Fraccionamiento habitacional,Alianza Real,Avenida,Barrio Guanajuato Privada Salvatierra Y Av. Revolucion,no,no,no,no,no,no,0,"25.845602, -100.390082",
,2022,Octubre-Diciembre,Fraccionamiento habitacional,Alianza Real,Calle,Barrio Hidalgo Privada Pachuca,no,no,no,no,no,no,0,"25.84749, -100.390506",
,2022,Octubre-Diciembre,Fraccionamiento habitacional,Alianza Real,Calle,Barrio Nuevo León Gral Escobedo Y Av. Revolucion,no,no,no,no,no,no,0,"25.844383, -100.394393",
,2022,Octubre-Diciembre,Fraccionamiento habitacional,Alianza Real,Calle,Barrio Nuevo León Privada San Pedro,no,no,no,no,no,no,0,"25.845949, -100.394648",
,2022,Octubre-Diciembre,Fraccionamiento habitacional,Alianza Real,Calle,Barrio Coahuila Privada Monclova,no,no,no,no,no,no,0,"25.844784, -100.395593",
,2022,Octubre-Diciembre,Fraccionamiento habitacional,Alianza Real,Calle,Barrio Puebla Privada Cuautla,no,no,no,no,no,no,0,"25.848318, -100.386097",
,2022,Octubre-Diciembre,Fraccionamiento habitacional,Alianza Real,Calle,Barrio Puebla  Privada Tlanepantla,no,no,no,no,no,no,0,"25.849013, -100.386432",
,2022,Octubre-Diciembre,Fraccionamiento habitacional,Alianza Real,Calle,Barrio Oaxaca Articulo 72 Y Loreto,no,no,no,no,no,no,0,"25.847143, -100.400751",
,2022,Octubre-Diciembre,Fraccionamiento habitacional,Alianza Real,CALLE,AVE. CONSTITUCION Y TULE,no,no,no,no,no,no,0,"25.841527, -100.405323",
,2022,Octubre-Diciembre,Fraccionamiento habitacional,Alianza Real,CALLE,AVE. CONSITUTUCION  ENTRE TULE Y AVE. PASEO DE LAS AVES,no,no,no,no,no,no,0,"25.842949, -100.403016",
,2022,Octubre-Diciembre,Fraccionamiento habitacional,Alianza Real,CALLE,AVE. CONSTITUCION ENTRE AVE. PASEO DE LAS AVES Y AVE. ARTICULO 72,no,no,no,no,no,no,0,"25.844676, -100.400204",
,2022,Octubre-Diciembre,Fraccionamiento habitacional,Alianza Real,CALLE,AVE. CONSTITUCION  ENTRE ARTICULO 43 Y AVE. ARTICULO 72,no,no,no,no,no,no,0,"25.846042, -100.397675",
,2022,Octubre-Diciembre,Fraccionamiento habitacional,Alianza Real,CALLE,AVE. CONTITUCION ENTRE ARTICULO 123,no,no,no,no,no,no,0,"25.848451, -100.393903",
,2022,Octubre-Diciembre,Fraccionamiento habitacional,Arboledas De Escobedo,Calle,Calle Consejo entre Cedro y Mezquite,si,si,si,si,no,si,1,"25.813556, -100.265694",
,2022,Octubre-Diciembre,Fraccionamiento habitacional,Bosques De Escobedo,Avenida,Calle Isla Caimán cruz con Isla Cortez,no,si,si,si,no,si,1,"25.803523, -100.336891",
,2022,Octubre-Diciembre,Fraccionamiento habitacional,Celestino Gasca,Avenida,Ave. Raúl Salinas Lozano y Tamaulipas,si,si,si,si,no,si,7,"25.770018, -100.316902",
,2022,Octubre-Diciembre,Fraccionamiento habitacional,Cerradas De Anáhuac,Avenida,Calle Abeto y avenida republica mexicana,si,si,no,si,no,si,5,"25.772633, -100.27235",
,2022,Octubre-Diciembre,Fraccionamiento habitacional,Cerradas De Anáhuac,Calle,Area Comun Acacia Begonia y crisantemo,,,,,,,,"25.773535, -100.271038",
,2022,Octubre-Diciembre,Fraccionamiento habitacional,Cerradas De Anáhuac,Calle,Calle Andador Oriente,no,no,no,no,no,no,0,"25.774369, -100.271154",
,2022,Octubre-Diciembre,Fraccionamiento habitacional,Cerradas De Anáhuac,Calle,Calle Andador Poniente,no,no,no,no,no,no,0,"25.775457, -100.275021",
,2022,Octubre-Diciembre,Fraccionamiento habitacional,Colinas De Anáhuac 2,Calle,Calle Monte Alpino Y Monte Alban,no,si,no,si,no,no,0,"25.768524, -100.322894",
,2022,Octubre-Diciembre,Fraccionamiento habitacional,Colinas De Anáhuac 3,Calle,Calle Cerro Del Mirador Y Sierra Taraumara,si,si,no,no,no,si,1,"25.770094, -100.323326",
,2022,Octubre-Diciembre,Fraccionamiento habitacional,Cortijo Los Ayala,Calle,Calle Golondrinas cruz con Garzas,no,si,si,si,no,no,0,"25.795464, -100.330028",
,2022,Octubre-Diciembre,Fraccionamiento habitacional,Encinas,Calle,Calle Coahuila cruz con Ocampo,si,si,si,si,no,si,1,"25.804911, -100.311316",
,2022,Octubre-Diciembre,Fraccionamiento habitacional,Eulalio Villarreal,Calle,Calle Agualeguas y Santiago roel,si,si,si,no,no,si,4,"25.802799, -100.369624",
,2022,Octubre-Diciembre,Fraccionamiento habitacional,Eulalio Villarreal,Calle,Sta. Catarina y Montemorelos,si,si,si,no,no,no,0,"25.803402, -100.372202",
,2022,Octubre-Diciembre,Fraccionamiento habitacional,Ex Hacienda El Canadá,Avenida,Bulevar Benito Juárez y Francisco Villa,si,si,si,si,no,si,2,"25.781232, -100.287631",
,2022,Octubre-Diciembre,Fraccionamiento habitacional,Felipe Carrillo,Calle,Enrique C. Livas Y Dr. Angel Martinez,si,si,si,si,no,si,2,"25.78188, -100.323197",
,2022,Octubre-Diciembre,Fraccionamiento habitacional,Fernando Amilpa,Calle,Calle fructuosa y Nectarina Plaza,si,si,si,si,no,si,4,"25.807266, -100.268967",
,2022,Octubre-Diciembre,Fraccionamiento habitacional,Fernando Amilpa,Calle,Calle Raúl Caballero,si,si,si,si,no,si,1,"25.803616, -100.273654",
,2022,Octubre-Diciembre,Fraccionamiento habitacional,Flores Magón,Calle,Calle José Vivanco cruz con Bonifacio Salinas DIF,no,si,si,si,no,si,3,"25.805791, -100.327432",
,2022,Octubre-Diciembre,Fraccionamiento habitacional,Flores Magón,Calle,Calle Alfonso Martínez Domínguez cruz con Jorge Treviño,no,si,si,si,no,si,1,"25.802254, -100.328104",
,2022,Octubre-Diciembre,Fraccionamiento habitacional,Fomerrey 36,Avenida,Miguel f. Mtz y ley federal del trabajo,no,si,si,no,no,no,0,"25.771231, -100.331242",
,2022,Octubre-Diciembre,Fraccionamiento habitacional,Girasoles 3,Calle,"Col. Girasoles 3er. Sector, calle Pino cruz con Roble",no,si,si,si,no,no,0,"25.778583, -100.326297",
,2022,Octubre-Diciembre,Fraccionamiento habitacional,Hacienda Sta. Julia,Calle,Ave. Acueducto de Hacienda Santa Julia a San Lázaro,no,si,si,no,no,no,0,"25.780837, -100.333216",
,2022,Octubre-Diciembre,Fraccionamiento habitacional,Haciendas De Anáhuac,Calle,Calle Hacienda de Guadalupe y Hacienda de Santa Bárbara,si,si,si,si,si,no,0,"25.76822, -100.31545",
,2022,Octubre-Diciembre,Fraccionamiento habitacional,Haciendas De Escobedo,Avenida,Ave. Hacienda del Rey cruz con Hacienda San Cristóbal,si,si,si,si,no,no,0,"25.781247, -100.306547",
,2022,Octubre-Diciembre,Fraccionamiento habitacional,Haciendas Del Topo,Calle,Calle. Plinio de Ordoñez cruz con hacienda del toro.,no,si,si,si,no,si,1,"25.790131, -100.329352",
,2022,Octubre-Diciembre,Fraccionamiento habitacional,Inf. Ex Hacienda El Canadá,Calle,Calle Cañada cruz con Vicente Guerrero,si,si,si,si,no,si,8,"25.7801, -100.296125",
,2022,Octubre-Diciembre,Fraccionamiento habitacional,Inf. Topo Grande,Calle,Calle Jaén cruz con Huelva,si,si,si,si,no,si,1,"25.782493, -100.315494",
,2022,Octubre-Diciembre,Fraccionamiento habitacional,Insurgentes,Calle,Calle Insurgentes cruz con Francisco Villa,si,si,si,si,no,si,1,"25.776302, -100.322546",
,2022,Octubre-Diciembre,Fraccionamiento habitacional,Jardines De Escobedo 1,Calle,"Col. Jardines de Escobedo l, calle Marciano González cruz con José E. Santos",si,si,si,si,no,si,1,"25.79999, -100.318371",
,2022,Octubre-Diciembre,Fraccionamiento habitacional,Jardines De Escobedo 2,Avenida,Genoveva Villarreal y Vía a torreón,no,si,si,si,no,si,1,"25.801519, -100.33038",
,2022,Octubre-Diciembre,Fraccionamiento habitacional,Jardines De Escobedo 2,Calle,Juan Guerra y Jesús Ayala Villarreal,no,si,si,si,no,no,0,"25.80669, -100.330004",
,2022,Octubre-Diciembre,Fraccionamiento habitacional,Jardines De Escobedo 3,Avenida,Calle flor de lis y ave. Barragán,si,si,no,si,no,si,1,"25.781459, -100.30305",
,2022,Octubre-Diciembre,Fraccionamiento habitacional,Jardines Del Canadá,Avenida,Ave. Jardines del Canadá y Canal Pluvial (Ojo De Agua),si,si,si,si,no,si,2,"25.798476, -100.307347",
,2022,Octubre-Diciembre,Fraccionamiento habitacional,Jardines Del Canadá,Calle,Rio Nazas e Hidalgo,no,si,si,si,no,no,0,"25.806398, -100.304819",
,2022,Octubre-Diciembre,Fraccionamiento habitacional,Jardines San Martin,Calle,"Col. Jardines de San Martin, calle Margaritas cruz con De las Rosas",si,si,si,si,no,no,0,"25.807014, -100.371907",
,2022,Octubre-Diciembre,Fraccionamiento habitacional,Joyas De Anáhuac,Calle,"Col. Joyas de Anáhuac, calle Vía Capri entre cruz con Jacobo Robusti",si,si,si,si,no,no,0,"25.77398, -100.313256",
,2022,Octubre-Diciembre,Fraccionamiento habitacional,Joyas De Anáhuac,Calle,"Col. Joyas de Anáhuac sector Florencia, calle Villas del Parque cruz con Vía Bari",si,si,si,si,no,si,1,"25.778911, -100.316144",
,2022,Octubre-Diciembre,Fraccionamiento habitacional,La Concordia,Avenida,La concordia camellón av. Sta. Úrsula y av. Mty.,si,no,si,no,no,no,0,"25.800884, -100.390729",
,2022,Octubre-Diciembre,Fraccionamiento habitacional,La Concordia 7,Calle,"Col. La Concordia 7 sector, Calle General Treviño cruz con Priv. Treviño",no,si,no,no,no,no,0,"25.802936, -100.392861",
,2022,Octubre-Diciembre,Fraccionamiento habitacional,La Concordia 8,Calle,"Col. La Concordia 8vo sector, calle Higueras cruz con Rayones",no,si,no,no,no,no,0,"25.802045, -100.392274",
,2022,Octubre-Diciembre,Fraccionamiento habitacional,La Unidad,Calle,Calle Unidad Americana cruz con Unidad Latinoamericana,si,si,si,no,no,si,1,"25.792816, -100.414167",
,2022,Octubre-Diciembre,Fraccionamiento habitacional,La Unidad,Calle,U. Técnica. Comercial y Unidad Americana,si,si,si,si,no,no,0,"25.798241, -100.415737",
,2022,Octubre-Diciembre,Fraccionamiento habitacional,La Unidad,Avenida,Calle Unidad Mexicana cruz con Ave. La Unidad,si,no,no,no,no,no,0,"25.792355, -100.41544",
,2022,Octubre-Diciembre,Fraccionamiento habitacional,Laderas De San Miguel 2,Avenida,Calle palo blanco entre nogal y av. Laderas,si,si,no,si,no,no,0,"25.838841, -100.406035",
,2022,Octubre-Diciembre,Fraccionamiento habitacional,Lomas De Aztlán,Calle,Loma el Volcán y Loma Larga,no,si,si,no,no,no,0,"25.768244, -100.330822",
,2022,Octubre-Diciembre,Fraccionamiento habitacional,Lomas De San Genaro,Avenida,Sicomoro y sauce I,no,si,si,si,no,si,1,"25.782004, -100.337332",
,2022,Octubre-Diciembre,Fraccionamiento habitacional,Los Vergeles,Calle,Col. Los Vergeles calle Rioja y Chardonay,si,si,si,si,no,si,1,"25.800877, -100.406753",
,2022,Octubre-Diciembre,Fraccionamiento habitacional,Miravista,Calle,Ocampo y Nueva Rosita (pegada a los Saldaña),no,no,no,no,no,no,0,"25.804265, -100.315309",
,2022,Octubre-Diciembre,Fraccionamiento habitacional,Monte Horeb,Calle,"Col. Monte Horeb, Ave. Monte Horeb y Monte de Sion",no,si,si,si,no,si,1,"25.796258, -100.338553",
,2022,Octubre-Diciembre,Fraccionamiento habitacional,Monterreal,Avenida,"Col. Monterreal, Ave. Raúl Caballero (plaza bomberos)",si,si,si,si,no,si,1,"25.796526, -100.322739",
,2022,Octubre-Diciembre,Fraccionamiento habitacional,Monterreal,Calle,"Col. Monterreal 4to sector, calle Paseo del Parque cruz con 2do Andador de la Cultura",no,si,si,no,no,no,0,"25.796653, -100.319352",
,2022,Octubre-Diciembre,Fraccionamiento habitacional,Monterreal,Calle,"Col. Monterreal 6to sector, calle Circuito Mundial",si,si,si,si,no,no,0,"25.795825, -100.315421",
,2022,Octubre-Diciembre,Fraccionamiento habitacional,Monterreal,Avenida,Circuito de la paz atrás de Benavides,no,no,no,si,no,no,0,"25.796457, -100.316927",
,2022,Octubre-Diciembre,Fraccionamiento habitacional,Nueva Esperanza,Avenida,"Col. Nueva Esperanza, calle Hidalgo y av. Monterrey",si,no,si,no,no,si,2,"25.796959, -100.390314",
,2022,Octubre-Diciembre,Fraccionamiento habitacional,Nueva Esperanza,deportivo,"Col. Nueva Esperanza, calle Iturbide cruz con Villa de Santiago, Santa Úrsula",no,no,no,no,no,no,0,"25.798976, -100.389197",
,2022,Octubre-Diciembre,Fraccionamiento habitacional,Nueva Hacienda,Calle,Ave. El Caporal cruz con calle Paraje plaza 2,si,no,si,no,no,si,1,"25.779357, -100.294008",
,2022,Octubre-Diciembre,Fraccionamiento habitacional,Pedregal,Calle,Platino y uranio,si,si,si,si,no,si,2,"25.805396, -100.361267",
,2022,Octubre-Diciembre,Fraccionamiento habitacional,Pedregal,Calle,Alabastro y basalto,si,si,si,si,no,no,0,"25.803333, -100.365404",
,2022,Octubre-Diciembre,Fraccionamiento habitacional,Portal Del Fraile,Calle,Calle Fray Servando,si,si,si,si,no,no,0,"25.799215, -100.411969",
,2022,Octubre-Diciembre,Fraccionamiento habitacional,Praderas De Girasoles,Avenida,Ave. Las Torres cruz con calle Siete,si,si,si,si,no,no,0,"25.792179, -100.321724",
,2022,Octubre-Diciembre,Fraccionamiento habitacional,Praderas De San Francisco,Calle,Juan pablo Segundo cruz con Liberio,no,si,no,no,no,no,0,"25.820613, -100.405898",
,2022,Octubre-Diciembre,Fraccionamiento habitacional,Praderas De San Francisco,Calle,Juan pablo cruz con Juan II,no,si,no,no,no,no,0,"25.818679, -100.410491",
,2022,Octubre-Diciembre,Fraccionamiento habitacional,Praderas De San Francisco,Calle,San Félix III cruz con Santos Inocentes,no,si,no,no,no,no,0,"25.818211, -100.408676",
,2022,Octubre-Diciembre,Fraccionamiento habitacional,Praderas De San Francisco,Calle,San juan I cruz con san Gelasio 1,no,si,no,no,no,no,0,"25.817598, -100.409332",
,2022,Octubre-Diciembre,Fraccionamiento habitacional,Praderas De San Francisco,Calle,San Ponciano cruz con San Sergio,si,si,si,no,no,no,0,"25.817283, -100.402587",
,2022,Octubre-Diciembre,Fraccionamiento habitacional,Praderas De San Francisco,Calle,San Teodoro Y San Francisco De Lego,no,si,si,si,no,no,0,"25.817366, -100.413118",
,2022,Octubre-Diciembre,Fraccionamiento habitacional,Praderas De San Francisco,Calle,San Benito De Aniane Y San Judas Tadeo,no,si,si,no,no,si,4,"25.822501, -100.418813",
,2022,Octubre-Diciembre,Fraccionamiento habitacional,Praderas De San Francisco,Calle,San Francisco Solano,no,no,si,si,no,si,2,"25.821313, -100.414907",
,2022,Octubre-Diciembre,Fraccionamiento habitacional,Praderas De San Francisco,Calle,San Juan Forest,no,si,no,no,no,si,1,"25.821104, -100.415734",
,2022,Octubre-Diciembre,Fraccionamiento habitacional,Praderas De San Francisco,Calle,San Blanco,no,no,si,si,no,no,0,"25.820905, -100.41659",
,2022,Octubre-Diciembre,Fraccionamiento habitacional,Praderas De San Francisco,Calle,San Bartolome,no,no,no,no,no,no,0,"25.820671, -100.417214",
,2022,Octubre-Diciembre,Fraccionamiento habitacional,Privadas De Camino Real 2,Calle,Calle Condor,si,si,no,no,no,no,0,"25.841664, -100.399914",
,2022,Octubre-Diciembre,Fraccionamiento habitacional,Privadas Del Sauce IV,Calle,Calle Azaleas cruz con Alcatraz,si,si,si,si,no,si,1,"25.820674, -100.310558",
,2022,Octubre-Diciembre,Fraccionamiento habitacional,Providencia,Avenida,Jesus Ayala Lopez Y Oquideas,no,si,no,si,no,no,0,"25.810013, -100.334785",
,2022,Octubre-Diciembre,Fraccionamiento habitacional,Provileon,Calle,Cerro del Tepeyac con cerro de Chapultepec,no,no,no,no,no,no,0,"25.789339, -100.338157",
,2022,Octubre-Diciembre,Fraccionamiento habitacional,Puerta Del Sol II,Calle,Calle Ancona,no,si,no,no,no,no,0,"25.798699, -100.342714",
,2022,Octubre-Diciembre,Fraccionamiento habitacional,Quinto Centenario,Avenida,Calle Cristóbal Colon cruz con Reyna Isabel de Castilla,no,si,si,si,no,no,0,"25.788965, -100.332422",
,2022,Octubre-Diciembre,Fraccionamiento habitacional,Renacimiento 1,Calle,Galileo Galilei y ave. Las torres,no,si,si,si,no,no,0,"25.800062, -100.331346",
,2022,Octubre-Diciembre,Fraccionamiento habitacional,Renacimiento 2,Calle,Leonardo da Vinci,no,si,no,si,no,no,2,"25.805944, -100.332977",
,2022,Octubre-Diciembre,Fraccionamiento habitacional,Residencial Escobedo,Calle,Calle los Álamos cruz con Abedules,si,si,si,no,no,no,0,"25.784777, -100.309987",
,2022,Octubre-Diciembre,Fraccionamiento habitacional,Residencial Palmiras,Calle,Calle Siete,si,si,no,no,no,no,0,"25.841541, -100.425501",
,2022,Octubre-Diciembre,Fraccionamiento habitacional,Residencial San Miguel,Calle,Calle San Fernando entre San Mateo y San Diego,si,si,si,si,no,no,0,"25.829864, -100.371397",
,2022,Octubre-Diciembre,Fraccionamiento habitacional,Residencial San Miguel,Calle,Calle San Fernando cruz con San Gabriel y Carpintero,si,si,si,si,no,si,4,"25.834024, -100.371209",
,2022,Octubre-Diciembre,Fraccionamiento habitacional,Roble Nuevo,Calle,Calle Villa de Cuba cruz con Villa de Honduras,si,si,no,si,no,si,1,"25.784893, -100.311864",
,2022,Octubre-Diciembre,Fraccionamiento habitacional,San Marcos,Calle,Gilberto Armienta calderón y circuito Abelardo Leal,si,si,no,no,no,no,0,"25.799692, -100.407308",
,2022,Octubre-Diciembre,Fraccionamiento habitacional,San Marcos,Calle,Circuito Jorge Villegas y el tío Rodolfo Guzmán,si,si,no,si,no,no,0,"25.801867, -100.41007",
,2022,Octubre-Diciembre,Fraccionamiento habitacional,San Marcos 2,Calle,Avelardo Leal  y Luis Carlos Treviño,si,si,no,no,no,no,0,"25.800547, -100.40763",
,2022,Octubre-Diciembre,Fraccionamiento habitacional,Santa Luz,Avenida,Calle Paris y Av. Unión incluye Circuito Paris,si,si,si,no,no,si,2,"25.798188, -100.34447",
,2022,Octubre-Diciembre,Fraccionamiento habitacional,Santa Luz,Calle,Calle Milán y Av. Laton,no,si,si,no,no,si,1,"25.794741, -100.346243",
,2022,Octubre-Diciembre,Fraccionamiento habitacional,Santa Luz,Avenida,Ave. Unión cruz con Barcelona,no,no,no,no,no,no,0,"25.800889, -100.343965",
,2022,Octubre-Diciembre,Fraccionamiento habitacional,Santa Martha,deportivo,"Col. Santa Martha , calle Santa Úrsula y Santa Elvira",no,no,no,no,no,no,0,"25.799287, -100.388144",
,2022,Octubre-Diciembre,Fraccionamiento habitacional,Serranías,Calle,Plaza Mirador calle Nacatas,si,no,no,no,no,no,0,"25.802105, -100.366184",
,2022,Octubre-Diciembre,Fraccionamiento habitacional,Serranías,Calle,Calle Santiago Roel Y Sierra San Cristobal,si,si,si,si,no,no,0,"25.803074, -100.367238",
,2022,Octubre-Diciembre,Fraccionamiento habitacional,Shalom,Calle,Calle Sonora cruz con Pátzcuaro,si,si,si,si,no,si,1,"25.800523, -100.313178",
,2022,Octubre-Diciembre,Fraccionamiento habitacional,Topo Grande,Calle,Calle Covadonga Y Pontevedra,si,si,no,si,no,no,0,"25.790476, -100.317037",
,2022,Octubre-Diciembre,Fraccionamiento habitacional,Valle De Girasoles,Calle,Calle Sépalo cruz con Cáliz,si,si,si,si,no,no,0,"25.790924, -100.316789",
,2022,Octubre-Diciembre,Fraccionamiento habitacional,Valle Del Canadá,Calle,Calle Ottawa cruz con Oro.,si,si,si,si,si,si,2,"25.770639, -100.286869",
,2022,Octubre-Diciembre,Fraccionamiento habitacional,Villas De Anáhuac Sector Alpes,Avenida,"Avenida Camino Real, plaza común",si,si,si,si,no,no,0,"25.770647, -100.284711",
,2022,Octubre-Diciembre,Fraccionamiento habitacional,Villas de San  Martin,Calle,San Benito y unidad Magisterial,si,si,si,si,no,no,0,"25.793243, -100.419102",
,2022,Octubre-Diciembre,Fraccionamiento habitacional,Villas De San Francisco,Calle,Calle Tecolote y Pelicano,si,si,si,si,no,no,0,"25.845679, -100.368247",
,2022,Octubre-Diciembre,Fraccionamiento habitacional,Villas De San Francisco,Calle,Calle Cigueña Y Chachalaca,si,si,si,si,no,no,0,"25.834163, -100.36517",
,2022,Julio-Septiembre,Fraccionamiento habitacional,18 De Octubre,Avenida,calle 24 de Septiembre cruz con 24 de Junio,si,si,si,si,no,si,1,"25.797228, -100.399578",
,2022,Julio-Septiembre,Fraccionamiento habitacional,Alianza Real,Calle,Barrio Michoacan Privada Los Reyes Y Avenida Revolución,no,no,no,si,no,no,0,"25.848426, -100.382303",
,2022,Julio-Septiembre,Fraccionamiento habitacional,Alianza Real,Calle,Barrio Morelos Revolución y art. 5°,no,si,no,si,no,si,1,"25.847441, -100.386191",
,2022,Julio-Septiembre,Fraccionamiento habitacional,Alianza Real,Calle,Barrio Coahuila Privada Torreon,no,si,no,no,no,no,0,"25.843822, -100.398346",
,2022,Julio-Septiembre,Fraccionamiento habitacional,Alianza Real,Calle,Privada Bellas artes,no,no,si,no,no,no,0,"25.847177, -100.380894",
,2022,Julio-Septiembre,Fraccionamiento habitacional,Alianza Real,Calle,Barrio Nayarit /Tepic y Guayabitos,no,no,no,no,no,no,0,"25.849035, -100.383792",
,2022,Julio-Septiembre,Fraccionamiento habitacional,Alianza Real,Calle,Barrio Puebla Privada Jalpan,no,no,no,no,no,no,0,"25.848632, -100.391036",
,2022,Julio-Septiembre,Fraccionamiento habitacional,Alianza Real,Calle,Barrio Puebla Privada Puebla,no,no,no,no,no,no,0,"25.849666, -100.388004",
,2022,Julio-Septiembre,Fraccionamiento habitacional,Alianza Real,Calle,Barrio Campeche Privada Candelaria,no,no,no,no,no,no,0,"25.843784, -100.390253",
,2022,Julio-Septiembre,Fraccionamiento habitacional,Alianza Real,Avenida,Barrio Campeche  Av. Revolucion Y Articulo 123,no,no,no,no,no,no,0,"25.845298, -100.390653",
,2022,Julio-Septiembre,Fraccionamiento habitacional,Alianza Real,Calle,Barrio Chihuahua Privada Heroes De La Revolución,no,no,no,no,no,no,0,"25.842707, -100.393264",
,2022,Julio-Septiembre,Fraccionamiento habitacional,Alianza Real,Calle,Barrio Nuevo León Privada Santiago,no,no,no,no,no,no,0,"25.84528, -100.394347",
,2022,Julio-Septiembre,Fraccionamiento habitacional,Alianza Real,Calle,Barrio Nuevo León Privada San Pedro,no,no,no,no,no,no,0,"25.845949, -100.394648",
,2022,Julio-Septiembre,Fraccionamiento habitacional,Alianza Real,Calle,Barrio Nuevo León Privada Apodaca,no,no,no,no,no,no,0,"25.847025, -100.391755",
,2022,Julio-Septiembre,Fraccionamiento habitacional,Alianza Real,Calle,Barrio Nuevo León Privada San Nicolas,no,no,no,no,no,no,0,"25.848155, -100.392235",
,2022,Julio-Septiembre,Fraccionamiento habitacional,Alianza Real,Avenida,Barrio Jalisco San Salvador Y Av. Revolucion,no,no,no,no,no,no,0,"25.845924, -100.390274",
,2022,Julio-Septiembre,Fraccionamiento habitacional,Alianza Real,Calle,Barrio Durango Privada Gomez Palacio,no,no,no,no,no,no,0,"25.843893, -100.394643",
,2022,Julio-Septiembre,Fraccionamiento habitacional,Alianza Real,Calle,Barrio Durango Privada Ricon De Romos,no,no,no,no,no,no,0,"25.842322, -100.394463",
,2022,Julio-Septiembre,Fraccionamiento habitacional,Alianza Real,Calle,Barrio Coahuila Privada Monclova,no,no,no,no,no,no,0,"25.844784, -100.395593",
,2022,Julio-Septiembre,Fraccionamiento habitacional,Alianza Real,Calle,Barrio Puebla  Privada Tlaxco,no,no,no,no,no,no,0,"25.850046, -100.386904",
,2022,Julio-Septiembre,Fraccionamiento habitacional,Alianza Real,Calle,Barrio Baja California Privada Mexicali,no,no,no,no,no,no,0,"25.850538, -100.392277",
,2022,Julio-Septiembre,Fraccionamiento habitacional,Alianza Real,CALLE,AVE. CONSTITUCION POR AV. CAMINO A LAS PEDRERAS,no,no,no,no,no,no,0,"25.838446, -100.410442",
,2022,Julio-Septiembre,Fraccionamiento habitacional,Alianza Real,CALLE,AVE. CONSITUTUCION  ENTRE TULE Y AVE. PASEO DE LAS AVES,no,no,no,no,no,no,0,"25.842949, -100.403016",
,2022,Julio-Septiembre,Fraccionamiento habitacional,Balcones De Anáhuac,Avenida,Ave. Acueducto cruz con San Judas Tadeo Y con San Rogelio,si,si,si,si,no,si,1,"25.76575, -100.322111",
,2022,Julio-Septiembre,Fraccionamiento habitacional,Balcones De Anáhuac,Avenida,Ave. Sendero y San Felipe,si,si,si,si,no,si,3,"25.764111, -100.327111",
,2022,Julio-Septiembre,Fraccionamiento habitacional,Balcones Del Norte,Calle,Reflexión y lado PTE: Balcones,si,si,si,si,no,no,0,"25.803615, -100.262641",
,2022,Julio-Septiembre,Fraccionamiento habitacional,Bosques De Quebec,Calle,Calle Toronto cruz con Quebec,si,si,si,no,no,si,1,"25.800918, -100.320312",
,2022,Julio-Septiembre,Fraccionamiento habitacional,Celestino Gasca,Avenida,Ave. Raúl Salinas Lozano y Tamaulipas,si,si,si,si,no,si,7,"25.770018, -100.316902",
,2022,Julio-Septiembre,Fraccionamiento habitacional,Cerradas De Anáhuac,Calle,Area Comun Acacia Begonia y crisantemo,,,,,,,,"25.773535, -100.271038",
,2022,Julio-Septiembre,Fraccionamiento habitacional,Cerradas De Anáhuac,Calle,Calle Andador Oriente,no,no,no,no,no,no,0,"25.774369, -100.271154",
,2022,Julio-Septiembre,Fraccionamiento habitacional,Cerradas De Anáhuac,Calle,Calle Andador Poniente,no,no,no,no,no,no,0,"25.775457, -100.275021",
,2022,Julio-Septiembre,Fraccionamiento habitacional,Emiliano Zapata,Calle,Calle Gerardo Villarreal cruz con E. Zapata,si,si,si,si,no,si,2,"25.807627, -100.287481",
,2022,Julio-Septiembre,Fraccionamiento habitacional,Escobedo Centro,Avenida,"Centro de Escobedo, calle Hidalgo y Raúl Caballero",no,no,no,no,no,no,0,"25.808464, -100.322492",
,2022,Julio-Septiembre,Fraccionamiento habitacional,Eucaliptos,Calle,Sauce entre Álamos y Fresnos,no,si,si,no,no,no,0,"25.804196, -100.320308",
,2022,Julio-Septiembre,Fraccionamiento habitacional,Eulalio Villarreal,Calle,Calle Agualeguas y Santiago roel,si,si,si,no,no,si,4,"25.802799, -100.369624",
,2022,Julio-Septiembre,Fraccionamiento habitacional,Felipe Carrillo,Calle,Calle Antonio I. Villarreal cruz con Pablo Quiroga,si,si,si,no,no,si,2,"25.778546, -100.320023",
,2022,Julio-Septiembre,Fraccionamiento habitacional,Felipe Carrillo,Calle,Calle Pablo A. De la Garza cruz con Eduardo A. Elizondo,si,si,no,si,no,si,1,"25.778712, -100.32223",
